"Title","Description","BiocVersion","Genome","SourceType","SourceUrl","SourceVersion","Species","TaxonomyId","Coordinate_1_based","DataProvider","Maintainer","RDataClass","DispatchClass","Location_Prefix","RDataPath","Tags"
"example_NRF1pair_amplicon.bam","Bam file contanining reads covering example NRF1 pair binding locus used for SingleMoleculeFootprinting vignette","3.13","mm10","FASTA","",1,"Mus musculus","10090",FALSE,"Arnaud Krebs <arnaud.krebs@embl.de>","Guido Barzaghi <guido.barzaghi@embl.de>","character","FilePath","","",""
"example_NRF1pair_amplicon.bam.bai","Bam index file to Bam file used as example data in SingleMoleculeFootprinting vignette","3.13","mm10","FASTA","",1,"Mus musculus","10090",FALSE,"Arnaud Krebs <arnaud.krebs@embl.de>","Guido Barzaghi <guido.barzaghi@embl.de>","character","FilePath","","",""
"EnrichmentRegions_mm10.rds","GRanges obj of mouse genomic regions enriched for SMF signal in genome-wide capture experiments. Can be used to compute bait capture efficiency","3.13","mm10","FASTA","",1,"Mus musculus","10090",FALSE,"Arnaud Krebs <arnaud.krebs@embl.de>","Guido Barzaghi <guido.barzaghi@embl.de>","GRanges","Rds","","",""
"ReducedRefMat.rds","Reference matrix of genome-wide bulk SMF(%) values for published experiments in mouse cell lines","3.13","mm10","FASTA","",1,"Mus musculus","10090",FALSE,"Arnaud Krebs <arnaud.krebs@embl.de>","Guido Barzaghi <guido.barzaghi@embl.de>","matrix","Rds","","",""
"AllCreduced.rds","GRanges obj referencing the genomic context cytosines for mm10","3.13","mm10","FASTA","",1,"Mus musculus","10090",FALSE,"Arnaud Krebs <arnaud.krebs@embl.de>","Guido Barzaghi <guido.barzaghi@embl.de>","GRanges","Rds","","",""
